{
  "version": "1.0.0",
  "updated_at": "2026-10-15",
  "source_notes": [
    "Legacy Mochi Experience publication state was last checked on 2026-08-14; it has not been rechecked or republished as part of the 2026-10-15 video refresh.",
    "This file is public-safe routing metadata. It intentionally excludes Vimeo embed hashes, expiring playback URLs, download URLs, credentials, and private connector state.",
    "Live Experience HTML remains the source of truth for the rendered card. This mapping is for agents deciding which video belongs with which slot.",
    "On 2026-10-15 at 04:18 UTC, Vimeo returned successful folder-move writes (HTTP 204): 1236068377 to 00 Welcome and 1236054521 to 20 Turns And Review. Independent folder readback was not available after these writes.",
    "The optional greatvibe-mobile-tips tutorial belongs in guest Web/Video content, not the first-login demo or a replacement Experience slot."
  ],
  "vimeo_folders": [
    {
      "key": "welcome",
      "name": "00 Welcome",
      "vimeo_project_uri": "/users/261676826/projects/30103803",
      "purpose": "Landing area for polished welcome videos that introduce GreatVibe to new users.",
      "status": "active",
      "expected_mochi_slots": [
        "first-login"
      ],
      "catalogue_video_slugs": [
        "greatvibe-welcome"
      ]
    },
    {
      "key": "using-mochi",
      "name": "10 Using Mochi",
      "vimeo_project_uri": "/users/261676826/projects/30103804",
      "purpose": "Practical videos about using Mochi, inspecting a node, starting work, and asking for help.",
      "status": "empty-ready",
      "expected_mochi_slots": [
        "first-login",
        "second-login"
      ]
    },
    {
      "key": "turns-and-review",
      "name": "20 Turns And Review",
      "vimeo_project_uri": "/users/261676826/projects/30103805",
      "purpose": "Videos about gvturn cards, review states, power footer actions, audits, and delivery status.",
      "status": "active",
      "expected_mochi_slots": [
        "broadcast",
        "second-login"
      ],
      "catalogue_video_slugs": [
        "greatvibe-mobile-tips"
      ]
    },
    {
      "key": "credentials-and-connectors",
      "name": "30 Credentials And Connectors",
      "vimeo_project_uri": "/users/261676826/projects/30103806",
      "purpose": "Credential, connector, and API access walkthroughs.",
      "status": "empty-ready",
      "expected_mochi_slots": [
        "broadcast"
      ]
    },
    {
      "key": "building-with-ai",
      "name": "40 Building With AI",
      "vimeo_project_uri": "/users/261676826/projects/30103807",
      "purpose": "Videos about using AI agents as part of a professional engineering workflow.",
      "status": "empty-ready",
      "expected_mochi_slots": [
        "broadcast",
        "third-login"
      ]
    },
    {
      "key": "tests-and-archive",
      "name": "90 Tests And Archive",
      "vimeo_project_uri": "/users/261676826/projects/30103808",
      "purpose": "Archive for tests, aspect-ratio checks, and videos that should not be suggested for onboarding.",
      "status": "archive"
    },
    {
      "key": "johnathon-quick-vids",
      "name": "JohnathonQuickVids",
      "vimeo_project_uri": "/users/261676826/projects/30087306",
      "purpose": "Legacy folder for the older first-screen recording; the current guest tour and mobile tutorial use the topic folders.",
      "status": "legacy-active",
      "expected_mochi_slots": [
        "broadcast"
      ],
      "catalogue_video_slugs": [
        "greatvibe-first-screen-recording"
      ]
    }
  ],
  "mochi_experience_slots": [
    {
      "slot": "first-login",
      "experience_id": "exp_first_login",
      "experience_title": "Start With Mochi",
      "status": "active",
      "published_version": 11,
      "catalogue_video_slug": "greatvibe-welcome",
      "vimeo_video_id": "1236068377",
      "vimeo_folder_key": "welcome",
      "use_when": "Use the greatvibe-welcome catalogue entry for the 12:14 guest console and Agent IQ tour; the guest demo uses this stable slug.",
      "related_docs": [
        "../how-to/watch-the-guest-tour.md",
        "../getting-started/ask-mochi-for-help.md",
        "../concepts/what-is-a-node.md"
      ],
      "notes": "Catalogue target: 1236068377, 12:14, 1:1; six chapters start at 0, 68, 167, 342, 459 and 560 seconds. The dashboard demo resolves the stable slug. Legacy Experience v11 was last recorded embedding 1217843223; its HTML was not rechecked or republished in this refresh. Do not infer live Experience content from the catalogue target. Private playback hashes remain in server-side overlays."
    },
    {
      "slot": "broadcast",
      "experience_id": "exp_broadcast",
      "experience_title": "What Changed In Mochi",
      "status": "active",
      "published_version": 5,
      "catalogue_video_slug": "greatvibe-first-screen-recording",
      "vimeo_video_id": "1214761385",
      "vimeo_folder_key": "johnathon-quick-vids",
      "use_when": "Show returning users a richer update about recent Mochi, gvturn, node, and platform workflow improvements.",
      "related_docs": [
        "../getting-started/welcome-to-greatvibe.md",
        "../getting-started/first-10-minutes.md",
        "../concepts/what-is-a-gvturn.md",
        "../concepts/what-is-the-gvturn-power-footer.md"
      ],
      "notes": "This is currently a broad walkthrough. Replace it with a tighter release-update video when a dedicated recording exists."
    }
  ],
  "placement_rules": [
    "Prefer `00 Welcome` for short first-login orientation videos once a polished replacement is ready.",
    "Prefer `10 Using Mochi` for task and node walkthroughs that help users start work.",
    "Prefer `20 Turns And Review` for gvturn, status, audit, and power footer videos.",
    "Prefer `30 Credentials And Connectors` for credential, connector, and external API setup videos.",
    "Prefer `40 Building With AI` for engineering workflow, planning, review, and build-process videos.",
    "Keep test clips, aspect-ratio checks, and obsolete recordings in `90 Tests And Archive` and do not suggest them in Mochi Experiences.",
    "Do not move an existing video that is embedded in an active Mochi Experience unless the Experience render path has been rechecked afterwards."
  ]
}
